{
  "record_id": "",
  "document_title_original": null,
  "document_title_translation": null,
  "document_date": null,
  "document_date_precision": "unknown",
  "document_date_raw": null,
  "calendar": null,
  "document_type": null,
  "creator": null,
  "recipient": null,
  "language": null,
  "source_category": "unverified",
  "original_repository": null,
  "online_host": null,
  "digital_producer": null,
  "fonds_or_collection": null,
  "series": null,
  "file_unit": null,
  "item_identifier": null,
  "archive_reference": null,
  "original_page_or_folio": null,
  "printed_page": null,
  "pdf_page": null,
  "digital_image_page": null,
  "catalogue_url": null,
  "fulltext_url": null,
  "digital_image_url": null,
  "original_text_excerpt": null,
  "excerpt_translation": null,
  "excerpt_location": null,
  "excerpt_verification_status": "none",
  "metadata_verification_status": "unverified",
  "document_access_status": "unknown",
  "content_verification_status": "unverified",
  "traceability_status": "untraceable",
  "research_relevance": null,
  "provenance_notes": null,
  "source_criticism": null,
  "access_date": null,
  "publication_date": null,
  "declassification_date": null,
  "digitization_date": null,
  "original_identity": null,
  "edition_identifier": null,
  "version_kind": "unknown",
  "independence_group": null,
  "supported_claims": [],
  "contradictory_claims": [],
  "remaining_uncertainties": [],
  "verified_fields": [],
  "is_simulation": false,
  "citation": null,
  "publication": null,
  "provenance_trail": [],
  "claim_evidence": [],
  "body_content_verified": false
}
